<?xml version="1.0" encoding="utf-8"?>
<item xmlns="http://www.gamned.org/bear/schema/0.5" xmlns:xsi="http://www.w3.org/2001/XMLSchema-instance" xsi:schemaLocation="http://www.gamned.org/bear/schema/0.5 http://www.gamned.org/bear/schema/0.5/item-description.xsd" class="bear::forced_aiming_creator" category="control/movement" box_color="#CAFF00" fixable="false" url="http://www.gamned.org/wiki/index.php/forced_aiming_creator">
  <inherit>
    <class>bear::base_item</class>
    <class>bear::forced_movement_tag</class>
    <class>bear::forced_movement_creator_with_reference</class>
  </inherit>
  <description>This class creates a forced movement of type "forced_aiming", applies it to itself then die.</description>
  <fields>
    <field type="real" name="forced_aiming_creator.duration">
      <description>The total time of the movement.</description>
      <default_value>infinity</default_value>
    </field>
    <field type="real" name="forced_aiming_creator.max_angle">
      <description>The maximum angle of the direction.</description>
      <default_value>infinity</default_value>
    </field>
    <field type="boolean" name="forced_aiming_creator.apply_angle">
      <description>Tell (true) if we apply the angle of the movement to the
        item.</description>
      <default_value>false</default_value>
    </field>
    <field type="real" name="forced_aiming_creator.max_speed">
      <description>The maximum speed of the movement.</description>
      <default_value>infinity</default_value>
    </field>
    <field type="real" name="forced_aiming_creator.acceleration">
      <description>The acceleration of the item.</description>
      <default_value>infinity</default_value>
    </field>
  </fields>
</item>
