<?xml version="1.0" encoding="utf-8"?>
<item xmlns="http://www.gamned.org/bear/schema/0.5" xmlns:xsi="http://www.w3.org/2001/XMLSchema-instance" xsi:schemaLocation="http://www.gamned.org/bear/schema/0.5 http://www.gamned.org/bear/schema/0.5/item-description.xsd" class="bear::line" category="decoration" box_color="#BE41D1" url="http://www.gamned.org/wiki/index.php/line">
  <inherit>
    <class>bear::base_item</class>
    <class>bear::basic_renderable_item</class>
  </inherit>
  <description>This item displays a line between several items.</description>
  <fields>
    <field type="item_reference" name="line.ends" list="true">
      <description>The ends of the segments of the line.</description>
      <default_value>none</default_value>
    </field>
    <field type="real" name="line.width">
      <description>The width of the line.</description>
      <default_value>1</default_value>
    </field>
  </fields>
</item>
