<?xml version="1.0" encoding="utf-8"?>
<item xmlns="http://www.gamned.org/bear/schema/0.5" xmlns:xsi="http://www.w3.org/2001/XMLSchema-instance" xsi:schemaLocation="http://www.gamned.org/bear/schema/0.5 http://www.gamned.org/bear/schema/0.5/item-description.xsd" class="bear::camera_shaker" category="control/camera" box_color="#D72F93" url="http://www.gamned.org/wiki/index.php/camera_shaker">
  <inherit>
    <class>bear::base_item</class>
    <class>bear::item_with_toggle</class>
  </inherit>
  <description>An item that shakes the camera.</description>
  <fields>
    <field type="real" name="camera_shaker.shaker_force">
      <description>The force to give to shake the camera.</description>
      <default_value>10</default_value>
    </field>
    <field type="boolean" name="camera_shaker.check_camera_intersection">
      <description>Indicates if the shaker checks camera intersection.</description>
      <default_value>true</default_value>
    </field>
  </fields>
  <new_default_value name="base_item.phantom">true</new_default_value>
  <new_default_value name="base_item.can_move_items">false</new_default_value>
  <new_default_value name="base_item.artificial">true</new_default_value>
</item>
