<?xml version="1.0" encoding="utf-8"?>
<item xmlns="http://www.gamned.org/bear/schema/0.5" xmlns:xsi="http://www.w3.org/2001/XMLSchema-instance" xsi:schemaLocation="http://www.gamned.org/bear/schema/0.5 http://www.gamned.org/bear/schema/0.5/item-description.xsd" class="bear::linear_binary_expression_creator" category="-abstract-" box_color="#69DAFF" fixable="false">
  <inherit>
    <class>bear::base_item</class>
    <class>bear::with_linear_expression_creation</class>
  </inherit>
  <fields>
    <field type="item_reference" name="binary_expression_creator.left_operand" required="true">
      <description>The left operand of the expression.</description>
      <set>
        <element value="bear::with_linear_expression_creation"/>
      </set>
    </field>
    <field type="item_reference" name="binary_expression_creator.right_operand" required="true">
      <description>The right operand of the expression.</description>
      <set>
        <element value="bear::with_linear_expression_creation"/>
      </set>
    </field>
  </fields>
</item>
