<?xml version="1.0" encoding="utf-8"?>
<item xmlns="http://www.gamned.org/bear/schema/0.5" xmlns:xsi="http://www.w3.org/2001/XMLSchema-instance" xsi:schemaLocation="http://www.gamned.org/bear/schema/0.5 http://www.gamned.org/bear/schema/0.5/item-description.xsd" class="bear::item_with_restricted_z_collision" category="-abstract-" url="http://www.gamned.org/wiki/index.php/item_with_restricted_z_collision">
  <fields>
    <field type="integer" name="item_with_restricted_z_collision.min_z_for_collision">
      <description>
        Minimum z-position of the other item to be aligned.
      </description>
      <default_value>-infinity</default_value>
    </field>
    <field type="integer" name="item_with_restricted_z_collision.max_z_for_collision">
      <description>
        Maximum z-position of the other item to be aligned.
      </description>
      <default_value>infinity</default_value>
    </field>
  </fields>
</item>
