<?xml version="1.0" encoding="utf-8"?>
<item xmlns="http://www.gamned.org/bear/schema/0.5" xmlns:xsi="http://www.w3.org/2001/XMLSchema-instance" xsi:schemaLocation="http://www.gamned.org/bear/schema/0.5 http://www.gamned.org/bear/schema/0.5/item-description.xsd" class="bear::forced_tracking_creator" category="control/movement" box_color="#CAFF00" fixable="false" url="http://www.gamned.org/wiki/index.php/forced_tracking_creator">
  <inherit>
    <class>bear::base_item</class>
    <class>bear::forced_movement_tag</class>
    <class>bear::forced_movement_creator_with_reference</class>
  </inherit>
  <description>This class creates a forced movement of type "forced_tracking", applies it to itself then die.</description>
  <fields>
    <field type="real" name="forced_tracking_creator.distance.x">
      <description>The distance to keep on the X axis.</description>
      <default_value>auto</default_value>
    </field>
    <field type="real" name="forced_tracking_creator.distance.y">
      <description>The distance to keep on the Y axis.</description>
      <default_value>auto</default_value>
    </field>
    <field type="real" name="forced_tracking_creator.duration">
      <description>The total time of the movement.</description>
      <default_value>infinity</default_value>
    </field>
  </fields>
</item>
