<?xml version="1.0" encoding="utf-8"?>
<item xmlns="http://www.gamned.org/bear/schema/0.5" xmlns:xsi="http://www.w3.org/2001/XMLSchema-instance" xsi:schemaLocation="http://www.gamned.org/bear/schema/0.5 http://www.gamned.org/bear/schema/0.5/item-description.xsd" class="bear::add_script_actor" category="script" box_color="#BA7EFF" url="http://www.gamned.org/wiki/index.php/add_script_actor">
  <inherit>
    <class>bear::base_item</class>
  </inherit>
  <description>An item that adds an actor in a script_director.</description>
  <fields>
    <field type="item_reference" name="add_script_actor.actor" required="true">
      <description>The new actor.</description>
    </field>
    <field type="string" name="add_script_actor.actor_name" required="true">
      <description>The name of the actor.</description>
    </field>
  </fields>
  <new_default_value name="base_item.artificial">true</new_default_value>
  <new_default_value name="base_item.phantom">true</new_default_value>
  <new_default_value name="base_item.can_move_items">false</new_default_value>
</item>
